{
  "version": "p8-daily-transit-v1",
  "scope": {
    "owner_user_id": "synthetic-owner-ayuan",
    "subject_id": "synthetic-subject-ayuan",
    "revision": 1,
    "operation_id": "synthetic-ayuan-daily-week-20261021"
  },
  "data": {
    "date": "2026-10-27",
    "snapshot_at": "2026-10-27T12:00:00+08:00",
    "snapshot_at_utc": "2026-10-27T04:00:00Z",
    "time_basis": {
      "primary": {
        "basis": "true_solar",
        "utc": "1994-03-12T00:20:00Z",
        "instant_id": "instant-d84ee400f41ac0430bcc690c",
        "coordinate_datetime": "1994-03-12T07:06:20.536889",
        "calendar_datetime": "1994-03-12T08:20:00",
        "civil_datetime": "1994-03-12 08:20",
        "civil_datetime_basis": "standard_clock_minute_for_legacy_only_when_compatible; exact UTC is authoritative",
        "timezone_offset": 8.0,
        "engine_longitude": 101.58557037249676,
        "engine_longitude_role": "effective_meridian_not_geographic_birth_longitude",
        "legacy_args_compatible": true,
        "pillars": {
          "year": "甲戌",
          "month": "丁卯",
          "day": "丁酉",
          "hour": "甲辰"
        },
        "pillar_method": {
          "year_month": "physical_UTC_plus8_exact_jie",
          "day_hour": "declared_coordinate_sect1_late_zi",
          "day_boundary": "23:00_advances_day",
          "subsecond_handling": "floor_to_engine_second"
        },
        "solar_time": {
          "standard": "1994-03-12T08:20:00",
          "beijing_standard": "1994-03-12T08:20:00",
          "mean_solar": "1994-03-12T07:16:16.800000",
          "true_solar": "1994-03-12T07:06:20.536889",
          "longitude": 104.07,
          "standard_central_meridian": 120.0,
          "longitude_correction_minutes": -63.72000000000003,
          "eot_minutes": -9.937718510012912,
          "eot_sign": "apparent_minus_mean",
          "method": "noaa-meeus-julian-century-equation-of-time-v1",
          "eot_evaluated_at": "1994-03-12T00:20:00Z",
          "source": "https://gml.noaa.gov/grad/solcalc/calcdetails.html",
          "limits": [
            "天文公式近似，不将同算法数值对照称为独立实测。",
            "太阳时是时钟坐标，不是另一个UTC瞬间。"
          ]
        },
        "jie_uncertainty": {
          "uncertain": false,
          "nearest_jie": "惊蛰",
          "calendar_boundary": "1994-03-06T03:37:42+08:00",
          "distance_seconds": 535338.0,
          "method": "physical_instant_UTC_plus8_not_solar_coordinate"
        },
        "assumptions": [
          "clock"
        ],
        "requires_confirmation": false,
        "timezone_source": {
          "zone": "Asia/Shanghai",
          "source": "explicit_environment_tzpath",
          "iana_version": "2026e",
          "tzdata_package_version": null,
          "zone_sha256": "bf8b7ed82fe6e63e6d98f8cea934eeac901cd16aba85eb5755ce3f8b4289ea8a",
          "historical_accuracy": "tzdb_convention_not_birth_document_verification",
          "selection_policy": "current_explicit_environment_then_package_then_unpinned_system",
          "source_limits": "caller_selected_files_may_differ_from_package_lock"
        },
        "engine_versions": {
          "lunar-python": "1.4.8"
        }
      },
      "comparisons": []
    },
    "bazi": {
      "natal_pillars": {
        "year": "甲戌",
        "month": "丁卯",
        "day": "丁酉",
        "hour": "甲辰"
      },
      "snapshot": {
        "date": "2026-10-27",
        "sample_at": "2026-10-27T12:00:00+08:00",
        "year": {
          "ganzhi": "丙午",
          "stem_ten_god": "劫财",
          "hidden_ten_gods": [
            {
              "stem": "丁",
              "ten_god": "比肩"
            },
            {
              "stem": "丙",
              "ten_god": "劫财"
            }
          ],
          "natal_relations": [
            {
              "pillar": "year",
              "natal_ganzhi": "甲戌",
              "relations": []
            },
            {
              "pillar": "month",
              "natal_ganzhi": "丁卯",
              "relations": []
            },
            {
              "pillar": "day",
              "natal_ganzhi": "丁酉",
              "relations": []
            },
            {
              "pillar": "hour",
              "natal_ganzhi": "甲辰",
              "relations": []
            }
          ],
          "transformation_established": false
        },
        "month": {
          "ganzhi": "戊戌",
          "stem_ten_god": "伤官",
          "hidden_ten_gods": [
            {
              "stem": "戊",
              "ten_god": "伤官"
            },
            {
              "stem": "丙",
              "ten_god": "劫财"
            },
            {
              "stem": "辛",
              "ten_god": "偏财"
            }
          ],
          "natal_relations": [
            {
              "pillar": "year",
              "natal_ganzhi": "甲戌",
              "relations": []
            },
            {
              "pillar": "month",
              "natal_ganzhi": "丁卯",
              "relations": [
                "地支六合"
              ]
            },
            {
              "pillar": "day",
              "natal_ganzhi": "丁酉",
              "relations": []
            },
            {
              "pillar": "hour",
              "natal_ganzhi": "甲辰",
              "relations": [
                "地支六冲"
              ]
            }
          ],
          "transformation_established": false
        },
        "day": {
          "ganzhi": "甲戌",
          "stem_ten_god": "正印",
          "hidden_ten_gods": [
            {
              "stem": "戊",
              "ten_god": "伤官"
            },
            {
              "stem": "丙",
              "ten_god": "劫财"
            },
            {
              "stem": "辛",
              "ten_god": "偏财"
            }
          ],
          "natal_relations": [
            {
              "pillar": "year",
              "natal_ganzhi": "甲戌",
              "relations": []
            },
            {
              "pillar": "month",
              "natal_ganzhi": "丁卯",
              "relations": [
                "地支六合"
              ]
            },
            {
              "pillar": "day",
              "natal_ganzhi": "丁酉",
              "relations": []
            },
            {
              "pillar": "hour",
              "natal_ganzhi": "甲辰",
              "relations": [
                "地支六冲"
              ]
            }
          ],
          "transformation_established": false
        },
        "hour": {
          "ganzhi": "庚午",
          "stem_ten_god": "正财",
          "hidden_ten_gods": [
            {
              "stem": "丁",
              "ten_god": "比肩"
            },
            {
              "stem": "丙",
              "ten_god": "劫财"
            }
          ],
          "natal_relations": [
            {
              "pillar": "year",
              "natal_ganzhi": "甲戌",
              "relations": []
            },
            {
              "pillar": "month",
              "natal_ganzhi": "丁卯",
              "relations": []
            },
            {
              "pillar": "day",
              "natal_ganzhi": "丁酉",
              "relations": []
            },
            {
              "pillar": "hour",
              "natal_ganzhi": "甲辰",
              "relations": []
            }
          ],
          "transformation_established": false
        },
        "hour_is_snapshot_only": true,
        "period_start": "2026-10-08T14:29:17+08:00",
        "period_end_exclusive": "2026-11-07T17:52:05+08:00"
      },
      "selected_schools": {
        "command": "sanming_5520",
        "tianyi": "combined_common",
        "blade": "yang_only"
      },
      "interactions": {
        "version": "p8-time-interactions-v1",
        "method": "p8-layered-structural-graph-v1",
        "school": "ziping-structural-relations-project-v1",
        "ordering_school": "子平",
        "ordering_label": "项目口径·子平视角",
        "priority_labels": {
          "子平": "项目口径·子平视角",
          "通用": "项目口径·通用"
        },
        "annotation_version": "p8-u12-interaction-labels-v2-review24",
        "annotation_status": "project_convention_v1_not_expert_calibrated",
        "annotation_basis": {
          "priority_source_status": "数字为项目排序参数，未作专家校准；不代表古籍或任何流派公认权重。调候、盲派排序未有可靠出处，暂停使用。",
          "palace_source": {
            "book": "子平真诠",
            "chapter": "第二十三章·论宫分用神配六亲",
            "url": "https://www.donglishuzhai.net/chapter/3736.html",
            "basis": "年月日時，自上而下；祖父妻子，亦自上而下。"
          },
          "palace_source_status": "祖、父、妻、子宫分已核公开原文转录，未作原刊校勘；现代关系称呼与检索领域是项目映射，不推出现实亲属事实。",
          "palace_modern_mappings": {
            "month": {
              "domains": [
                "事业",
                "学业"
              ],
              "status": "现代常用检索映射，非第二十三章原文"
            }
          },
          "palace_pending_claims": [
            "年柱早年、月柱青年、时柱晚年的具体年龄范围存疑，待核《渊海子平》。",
            "月柱兼指兄弟存疑，不能用本章祖父妻子句作证。"
          ],
          "ten_god_traditional_mappings": {
            "source": {
              "book": "子平真诠",
              "chapter": "第二十三章·论宫分用神配六亲",
              "url": "https://www.donglishuzhai.net/chapter/3736.html",
              "basis": "年月日時，自上而下；祖父妻子，亦自上而下。"
            },
            "male_context": {
              "正印": "母",
              "偏财": "父",
              "正财": "妻",
              "正官": "子女",
              "七杀": "子女",
              "比肩": "兄弟"
            },
            "source_status": "传统说法；正印为母、偏财为父、正财为妻、官杀为子女、比肩为兄弟已核第二十三章公开转录。",
            "female_context": {
              "正官": "夫（待核）",
              "七杀": "夫星扩展（待核）",
              "食神": "子女（待核）",
              "伤官": "子女（待核）"
            },
            "female_source_status": "出处待核《渊海子平》《三命通会》女命篇，本轮未得可靠对应原文；不得冒称第二十三章已支持。",
            "modern_boundary": "这些是传统性别家庭模型，不据此推断实际家庭角色、亲属关系、性别认同、性取向、婚姻状态或婚育意愿。domains为宽泛检索标签，不是现实事实或未询问的关系断言。"
          },
          "ten_god_domain_status": "事业/学业/财运/性格为项目现代检索标签；婚恋与六亲包括传统男女命对应，必须连同traditional_mappings的性别语境与待核状态说明，不按标签断事。"
        },